<?xml version="1.0" encoding="UTF-8"?>
<!--
To change this license header, choose License Headers in Project Properties.
To change this template file, choose Tools | Templates
and open the template in the editor.
-->
<!DOCTYPE EmployeeDetails SYSTEM "newXMLDocument.dtd">

<EmployeeDetails>
    <Employee id="Emp1">
        <Name>Giridhar</Name>
        <Designation>Software Trainee</Designation>
        <Salary>50000</Salary>
    </Employee>
    <Employee id="Emp2">
        <Name>Pavan</Name>
        <Designation>Software Trainee</Designation>
        <Salary>5000</Salary>
    </Employee>
</EmployeeDetails>

